{
  "spec": "ailineage/0.1",
  "artifact": {
    "id": "urn:sha256:3858e22029fb35d888def1c84d0d7a42e59e699df58ae25375b22f3ca82d33ea",
    "media_type": "audio/wav",
    "created_at": "2026-10-19T07:15:00Z",
    "size_bytes": 9644
  },
  "generation": {
    "kind": "created",
    "model": {
      "id": "ace-step/acestep-v15-turbo",
      "provider": "ace-step.github.io",
      "version_hash": "sha256:75cb620cbaa362c9732cdb0a65376d23f9f12c1d05621fb605099a2a7a2c920f"
    },
    "runtime": {
      "tool": "AiStack services/audio 0.3",
      "seed": 7,
      "params_hash": "sha256:03c6d318b3f36fee8a7269df59a8b8a1c0d6689b217ca2a52db056b319d2cfba"
    }
  },
  "prompt": {
    "hash": "sha256:cd40a98e537b073bda2a4b26d786180905418093ad858512ec914f59e3df2a7b",
    "canonicalization": "utf8-nfc-trim-v1",
    "storage": "escrow",
    "escrow_ref": "urn:ailineage:escrow:registry.ailineage.org:01J9ZK6C3D4E5F6G7H8J9K0M1N",
    "disclosure_policy": "owner",
    "contains_pii": false
  },
  "parents": [],
  "actor": {
    "principal": "did:web:ol1n.com",
    "role": "operator",
    "pseudonymous": false
  },
  "flags": [
    "training-opt-out"
  ],
  "signature": {
    "alg": "ES256",
    "kid": "did:key:zDnaeXkYxJD9xrtfGoZccRWebW1QoehoSAd9VdNhxxtDLKZWV#zDnaeXkYxJD9xrtfGoZccRWebW1QoehoSAd9VdNhxxtDLKZWV",
    "ts": "MIISFgYJKoZIhvcNAQcCoIISBzCCEgMCAQMxDzANBglghkgBZQMEAgMFADCCAZAGCyqGSIb3DQEJEAEEoIIBfwSCAXswggF3AgEBBgQqAwQBMDEwDQYJYIZIAWUDBAIBBQAEIMIwUf/Mimr5M5mHw2lqC0v2gIMYAawydEubWp5pbmKEAgQJRuAiGA8yMDI2MTAxOTA4NTgyMloBAf8CCCeIrokQzK5joIIBE6SCAQ8wggELMREwDwYDVQQKDAhGcmVlIFRTQTEMMAoGA1UECwwDVFNBMXYwdAYDVQQNDG1UaGlzIGNlcnRpZmljYXRlIGRpZ2l0YWxseSBzaWducyBkb2N1bWVudHMgYW5kIHRpbWUgc3RhbXAgcmVxdWVzdHMgbWFkZSB1c2luZyB0aGUgZnJlZXRzYS5vcmcgb25saW5lIHNlcnZpY2VzMRgwFgYDVQQDDA93d3cuZnJlZXRzYS5vcmcxJDAiBgkqhkiG9w0BCQEWFWJ1c2lsZXphc0BtYWlsYm94Lm9yZzESMBAGA1UEBwwJV3VlcnpidXJnMQswCQYDVQQGEwJERTEPMA0GA1UECAwGQmF5ZXJuoIIOZzCCBmAwggRIoAMCAQICCQDC6YYWDajpzTANBgkqhkiG9w0BAQ0FADCBlTERMA8GA1UEChMIRnJlZSBUU0ExEDAOBgNVBAsTB1Jvb3QgQ0ExGDAWBgNVBAMTD3d3dy5mcmVldHNhLm9yZzEiMCAGCSqGSIb3DQEJARYTYnVzaWxlemFzQGdtYWlsLmNvbTESMBAGA1UEBxMJV3VlcnpidXJnMQ8wDQYDVQQIEwZCYXllcm4xCzAJBgNVBAYTAkRFMB4XDTI2MDIxNTE5NDQyMloXDTQwMDIwMjE5NDQyMlowggELMREwDwYDVQQKDAhGcmVlIFRTQTEMMAoGA1UECwwDVFNBMXYwdAYDVQQNDG1UaGlzIGNlcnRpZmljYXRlIGRpZ2l0YWxseSBzaWducyBkb2N1bWVudHMgYW5kIHRpbWUgc3RhbXAgcmVxdWVzdHMgbWFkZSB1c2luZyB0aGUgZnJlZXRzYS5vcmcgb25saW5lIHNlcnZpY2VzMRgwFgYDVQQDDA93d3cuZnJlZXRzYS5vcmcxJDAiBgkqhkiG9w0BCQEWFWJ1c2lsZXphc0BtYWlsYm94Lm9yZzESMBAGA1UEBwwJV3VlcnpidXJnMQswCQYDVQQGEwJERTEPMA0GA1UECAwGQmF5ZXJuMHYwEAYHKoZIzj0CAQYFK4EEACIDYgAEohXhobLWy4cYsdKOFALpjUsB1FJTntwwb7PH2LOfNMAA1ufaKhkgsdeW6etU0pl5MC5tSVuPF52yy4sz+mbY3L7IVdx/bs9m0ud7IA14YNcC2yIQLa2gvnxwsrR3rlWro4IB5jCCAeIwCQYDVR0TBAIwADAdBgNVHQ4EFgQUFcC9JuvUXYLRXZMmMS/vcLKLRl4wHwYDVR0jBBgwFoAU+lUNjDRmUUNM9+ezp2yVr3rmpJcwCwYDVR0PBAQDAgbAMBYGA1UdJQEB/wQMMAoGCCsGAQUFBwMIMGwGCCsGAQUFBwEBBGAwXjAzBggrBgEFBQcwAoYnaHR0cDovL3d3dy5mcmVldHNhLm9yZy9maWxlcy9jYWNlcnQucGVtMCcGCCsGAQUFBzABhhtodHRwOi8vd3d3LmZyZWV0c2Eub3JnOjI1NjAwNwYDVR0fBDAwLjAsoCqgKIYmaHR0cDovL3d3dy5mcmVldHNhLm9yZy9jcmwvcm9vdF9jYS5jcmwwgcgGA1UdIASBwDCBvTCBugYDKwUIMIGyMDMGCCsGAQUFBwIBFidodHRwOi8vd3d3LmZyZWV0c2Eub3JnL2ZyZWV0c2FfY3BzLmh0bWwwMgYIKwYBBQUHAgEWJmh0dHA6Ly93d3cuZnJlZXRzYS5vcmcvZnJlZXRzYV9jcHMucGRmMEcGCCsGAQUFBwICMDsaOUZyZWVUU0EgdHJ1c3RlZCB0aW1lc3RhbXBpbmcgU29mdHdhcmUgYXMgYSBTZXJ2aWNlIChTYWFTKTANBgkqhkiG9w0BAQ0FAAOCAgEAazFUv2H53zK9M4mZ3rAVDqwzUazTYLdyIDDQ8DYcJeqClh1SIZWJzP+W6JY326WUwG6r8RyN87U9P7MMUDqk2reagSUQGP1R9Z/0+DPbg40rrt6n4dGR+Ty/RDaqFVuOIuTU/850Hr9jBlzgB8M/ZGcMM8/TBV+oWxoQalmvp5QKm+2O9ihc4995tTlR8VdlpeGA/X/dW2UxaVBBluCrW5JsaX/4hiD2n+Fh6aAVvzuhM6HzCmJc+Ml8hAYdMEUVcl5bS64/jBR6oXvj7DAZZav3QmjuFvxfgLhxJbu2lGFjAEnpaYVgCYlLDTK+RwKHgkkoIpan9QkqFgvpOnuN9+BcpviMuHLDHsfjxuK0nalyVUPgFhHUWo0jyoe8g36TZHZzusqkCf7UnddV0OXC9DPY1rgg9cx5YAPrvkdnK8t8qNt4w+6kxi4WalL1wslooB99P0P0V44w8K3OAyYkPoEWNBYXU2Kpb4DAT6+C3CSpzZLIr3Y/pG8+21Um6wQM0YmsyvZfONf+VzLT/Qbw9ISgqUBbz/T0oAgvBEJyqoEntuhUiQWgEHAOU5yvDReI5GxJQcX/88oez9yIx7KN+Y7YFFg9f4rYPQSVm2FMCeLXyC6QdhdMG5NRnGQwg2aMlt1397awKc/2Xfd4Bd46HPR4fURb3ikc1kO3XVLd3oEwggf/MIIF56ADAgECAgkAwemGFg2o6YAwDQYJKoZIhvcNAQENBQAwgZUxETAPBgNVBAoTCEZyZWUgVFNBMRAwDgYDVQQLEwdSb290IENBMRgwFgYDVQQDEw93d3cuZnJlZXRzYS5vcmcxIjAgBgkqhkiG9w0BCQEWE2J1c2lsZXphc0BnbWFpbC5jb20xEjAQBgNVBAcTCVd1ZXJ6YnVyZzEPMA0GA1UECBMGQmF5ZXJuMQswCQYDVQQGEwJERTAeFw0xNjAzMTMwMTUyMTNaFw00MTAzMDcwMTUyMTNaMIGVMREwDwYDVQQKEwhGcmVlIFRTQTEQMA4GA1UECxMHUm9vdCBDQTEYMBYGA1UEAxMPd3d3LmZyZWV0c2Eub3JnMSIwIAYJKoZIhvcNAQkBFhNidXNpbGV6YXNAZ21haWwuY29tMRIwEAYDVQQHEwlXdWVyemJ1cmcxDzANBgNVBAgTBkJheWVybjELMAkGA1UEBhMCREUwggIiMA0GCSqGSIb3DQEBAQUAA4ICDwAwggIKAoICAQC2Ao4OMDLxERDZZM2pS50CeOGUKukTqqWZB82ml5OZW9msfjO62f43BNocAamNIa/j9ZGlnXBncFFnmY9QFnIuCrRish9DkXHSz8xFk/NzWveUpasxH2wBDHiY3jPXXEUQ7nb0vR0UmM8X0wPwal3Z95bMbKm2V6Vv4+pP77585rahjT41owzuX/Fw0c85ozPT/aiWTSLbaFsp5WG+iQ8KqEWHOy6Eqyarg5/+j63p0juzHmHSc8ybiAZJGF+r7PoFNGAKupAbYU4uhUWC3qIib8Gc199SvtUNh3fNmYjAU6P8fcMoegaKT/ErcTzZgDZm6VU4VFb/OPgCmM9rk4VukiR3SmbPHN0Rwvjv2FID10WLJWZLE+1jnN7U/4ET1sxTU9JylHPDwwcVfHIqpbXdC/stbDixuTdJyIHsYAJtCJUbOCS9cbrLzkc669Y28LkYtKLI/0aU8HRXry1vHPglVNF3D9ef9dMU3NEEzdyryUE4BW388Bfn64Vy/VL3AUTxiNoF9YI/WN0GKX5zh77S13LBPagmZgEEX+QS3XCYbAyYe6c0S5A3OHUW0ljniFtR+JaLfyYBITvEy0yF+P8LhK9qmIM3zfuBho9+zzHcpnFtfsLdgCwWcmKeXABSyzV90pqvxD9hWzsf+dThzgjHHHPh/rt9xWozYhMp6e1sIwIDAQABo4ICTjCCAkowDAYDVR0TBAUwAwEB/zAOBgNVHQ8BAf8EBAMCAcYwHQYDVR0OBBYEFPpVDYw0ZlFDTPfns6dsla965qSXMIHKBgNVHSMEgcIwgb+AFPpVDYw0ZlFDTPfns6dsla965qSXoYGbpIGYMIGVMREwDwYDVQQKEwhGcmVlIFRTQTEQMA4GA1UECxMHUm9vdCBDQTEYMBYGA1UEAxMPd3d3LmZyZWV0c2Eub3JnMSIwIAYJKoZIhvcNAQkBFhNidXNpbGV6YXNAZ21haWwuY29tMRIwEAYDVQQHEwlXdWVyemJ1cmcxDzANBgNVBAgTBkJheWVybjELMAkGA1UEBhMCREWCCQDB6YYWDajpgDAzBgNVHR8ELDAqMCigJqAkhiJodHRwOi8vd3d3LmZyZWV0c2Eub3JnL3Jvb3RfY2EuY3JsMIHPBgNVHSAEgccwgcQwgcEGCisGAQQBgfIkAQEwgbIwMwYIKwYBBQUHAgEWJ2h0dHA6Ly93d3cuZnJlZXRzYS5vcmcvZnJlZXRzYV9jcHMuaHRtbDAyBggrBgEFBQcCARYmaHR0cDovL3d3dy5mcmVldHNhLm9yZy9mcmVldHNhX2Nwcy5wZGYwRwYIKwYBBQUHAgIwOxo5RnJlZVRTQSB0cnVzdGVkIHRpbWVzdGFtcGluZyBTb2Z0d2FyZSBhcyBhIFNlcnZpY2UgKFNhYVMpMDcGCCsGAQUFBwEBBCswKTAnBggrBgEFBQcwAYYbaHR0cDovL3d3dy5mcmVldHNhLm9yZzoyNTYwMA0GCSqGSIb3DQEBDQUAA4ICAQBor36/k4Vi70zrO1gL4vr2zDWiZ3KWLz2VkB+lYwyH0JGYmEzooGoz+KnCgu2fHLEaxsI+FxCO5O/Ob7KU3pXBMyYiVXJVIsphlx1KO394JQ37jUruwPsZWbFkEAUgucEOZMYmYuStTQq64imPyUj8Tpno2ea4/b5EBBIex8FCLqyyydcyjgc5bmC087uAOtSlVcgP77U/hed2SgqftK/DmfTNL1+/WHEFxggc89BTN7a7fRsBC3SfSIjJEvNpa6G2kC13t9/ARsBKDMHsT40YXi2lXft7wqIDbGIZJGpPmd27bx+Ck5jzuAPcCtkNy1m+9MJ8d0BLmQQ7eCcYZ5kRUsOZ8Sy/xMYlrcCWNVrkTjQhAOxRelAuLwb5QLjUNZm7wRVPiudhoLDVVftKE5HU80IK+NvxLy1925133OFTeAQHSvF15PLW1Vs0tdb33L3TFzCvVkgNTAz/FD+eg7wVGGbQug8LvcR/4nhkF2u9bBq4XfMl7fd3iJvERxvz+nPlbMWR6LFgzaeweGoewErDsk+i4o1dGeXkgATV4WaoPILsb9VPs4Xrr3EzqFtS3kbbUkThw0ro025xL5/ODUk9fT7dWGxhmOPsPm6WNG9BesnyIeCv8zqPagse9MAjYwt2raqNkUM4JezEHEmluYsYHH2jDpl6uVTHPCzYBa/amTGCAewwggHoAgEBMIGjMIGVMREwDwYDVQQKEwhGcmVlIFRTQTEQMA4GA1UECxMHUm9vdCBDQTEYMBYGA1UEAxMPd3d3LmZyZWV0c2Eub3JnMSIwIAYJKoZIhvcNAQkBFhNidXNpbGV6YXNAZ21haWwuY29tMRIwEAYDVQQHEwlXdWVyemJ1cmcxDzANBgNVBAgTBkJheWVybjELMAkGA1UEBhMCREUCCQDC6YYWDajpzTANBglghkgBZQMEAgMFAKCBuDAaBgkqhkiG9w0BCQMxDQYLKoZIhvcNAQkQAQQwHAYJKoZIhvcNAQkFMQ8XDTI2MTAxOTA4NTgyMlowKwYLKoZIhvcNAQkQAgwxHDAaMBgwFgQUSB/VPFNNOEGAwChlGaA2+YhUR2YwTwYJKoZIhvcNAQkEMUIEQOvGCi17XtgjCC4/Wtus9aSY2mNXThWklhU+/T6L0SJV0+F0EMzAjKhAilScV6AuVpLPEIdb0HtedC4PM4mJnG8wCgYIKoZIzj0EAwQEZzBlAjBqHwBYQYNxm83P++fRZokh3NlGXodXdiNUDk8q/paQU6mxjoff2SuADuLtbDW4Vg4CMQCWD8OLRxiiNflblk83ksYyjMdW0fOTSQilPKK14bjO5gnYnOqd4ROZ7mJSNX2MDxA=",
    "sig": "lZPYapF_u9jiFqD5Vhj6idlIbi007kqU8QU9aX4BJUuyp9rCnW8mWnjUN-JuGnmL2togfWI-jl-FdZbUFgq8Rg"
  }
}
