{
  "spec": "ailineage/0.1",
  "artifact": {
    "id": "urn:sha256:7287db815fa9c6323d08ab8f49621ff111c4ad844a77e1613876c086710c357a",
    "media_type": "video/mp4",
    "created_at": "2026-10-19T07:20:00Z",
    "size_bytes": 1707
  },
  "generation": {
    "kind": "derived",
    "model": {
      "id": "wan-ai/wan2.2-ti2v-5b",
      "provider": "wan.video",
      "version_hash": "sha256:8b969560767df56492c83d9f9e493219650498710add70756e0ab25d693f6c9a"
    },
    "runtime": {
      "tool": "ComfyUI 0.4.1",
      "seed": 99
    }
  },
  "prompt": {
    "hash": "sha256:f13cb48b46eec07aff2ee6b86401f588d68bf98b118c8169d965625b75beb8b1",
    "canonicalization": "utf8-nfc-trim-v1",
    "storage": "escrow",
    "escrow_ref": "urn:ailineage:escrow:registry.ailineage.org:01J9ZK7D4E5F6G7H8J9K0M1N2P",
    "disclosure_policy": "on-legal-request",
    "contains_pii": false
  },
  "parents": [
    {
      "id": "urn:sha256:515a9b17edac1e580fbd9f711659cb619b741ce7b5e5ba92d7ead150b004e23b",
      "relation": "input",
      "lineage_ref": "urn:ailineage:registry:registry.ailineage.org:515a9b17edac1e580fbd9f711659cb619b741ce7b5e5ba92d7ead150b004e23b"
    }
  ],
  "actor": {
    "principal": "did:web:ol1n.com",
    "role": "operator",
    "pseudonymous": false
  },
  "flags": [
    "deepfake-candidate"
  ],
  "signature": {
    "alg": "EdDSA",
    "kid": "did:key:z6MkunqAcgKusG7fp3hXi2TXxdTZm7eomDR6ASgvWhLHeu6n#z6MkunqAcgKusG7fp3hXi2TXxdTZm7eomDR6ASgvWhLHeu6n",
    "ts": "MIISGAYJKoZIhvcNAQcCoIISCTCCEgUCAQMxDzANBglghkgBZQMEAgMFADCCAZEGCyqGSIb3DQEJEAEEoIIBgASCAXwwggF4AgEBBgQqAwQBMDEwDQYJYIZIAWUDBAIBBQAEIJvBRvtCM9BvBBdOy/AFsmiv1gLxywAvgzNGLj7Gl7YrAgQJRuAmGA8yMDI2MTAxOTA4NTgyMloBAf8CCQCJSYiU2pu/IaCCAROkggEPMIIBCzERMA8GA1UECgwIRnJlZSBUU0ExDDAKBgNVBAsMA1RTQTF2MHQGA1UEDQxtVGhpcyBjZXJ0aWZpY2F0ZSBkaWdpdGFsbHkgc2lnbnMgZG9jdW1lbnRzIGFuZCB0aW1lIHN0YW1wIHJlcXVlc3RzIG1hZGUgdXNpbmcgdGhlIGZyZWV0c2Eub3JnIG9ubGluZSBzZXJ2aWNlczEYMBYGA1UEAwwPd3d3LmZyZWV0c2Eub3JnMSQwIgYJKoZIhvcNAQkBFhVidXNpbGV6YXNAbWFpbGJveC5vcmcxEjAQBgNVBAcMCVd1ZXJ6YnVyZzELMAkGA1UEBhMCREUxDzANBgNVBAgMBkJheWVybqCCDmcwggZgMIIESKADAgECAgkAwumGFg2o6c0wDQYJKoZIhvcNAQENBQAwgZUxETAPBgNVBAoTCEZyZWUgVFNBMRAwDgYDVQQLEwdSb290IENBMRgwFgYDVQQDEw93d3cuZnJlZXRzYS5vcmcxIjAgBgkqhkiG9w0BCQEWE2J1c2lsZXphc0BnbWFpbC5jb20xEjAQBgNVBAcTCVd1ZXJ6YnVyZzEPMA0GA1UECBMGQmF5ZXJuMQswCQYDVQQGEwJERTAeFw0yNjAyMTUxOTQ0MjJaFw00MDAyMDIxOTQ0MjJaMIIBCzERMA8GA1UECgwIRnJlZSBUU0ExDDAKBgNVBAsMA1RTQTF2MHQGA1UEDQxtVGhpcyBjZXJ0aWZpY2F0ZSBkaWdpdGFsbHkgc2lnbnMgZG9jdW1lbnRzIGFuZCB0aW1lIHN0YW1wIHJlcXVlc3RzIG1hZGUgdXNpbmcgdGhlIGZyZWV0c2Eub3JnIG9ubGluZSBzZXJ2aWNlczEYMBYGA1UEAwwPd3d3LmZyZWV0c2Eub3JnMSQwIgYJKoZIhvcNAQkBFhVidXNpbGV6YXNAbWFpbGJveC5vcmcxEjAQBgNVBAcMCVd1ZXJ6YnVyZzELMAkGA1UEBhMCREUxDzANBgNVBAgMBkJheWVybjB2MBAGByqGSM49AgEGBSuBBAAiA2IABKIV4aGy1suHGLHSjhQC6Y1LAdRSU57cMG+zx9iznzTAANbn2ioZILHXlunrVNKZeTAubUlbjxedssuLM/pm2Ny+yFXcf27PZtLneyANeGDXAtsiEC2toL58cLK0d65Vq6OCAeYwggHiMAkGA1UdEwQCMAAwHQYDVR0OBBYEFBXAvSbr1F2C0V2TJjEv73Cyi0ZeMB8GA1UdIwQYMBaAFPpVDYw0ZlFDTPfns6dsla965qSXMAsGA1UdDwQEAwIGwDAWBgNVHSUBAf8EDDAKBggrBgEFBQcDCDBsBggrBgEFBQcBAQRgMF4wMwYIKwYBBQUHMAKGJ2h0dHA6Ly93d3cuZnJlZXRzYS5vcmcvZmlsZXMvY2FjZXJ0LnBlbTAnBggrBgEFBQcwAYYbaHR0cDovL3d3dy5mcmVldHNhLm9yZzoyNTYwMDcGA1UdHwQwMC4wLKAqoCiGJmh0dHA6Ly93d3cuZnJlZXRzYS5vcmcvY3JsL3Jvb3RfY2EuY3JsMIHIBgNVHSAEgcAwgb0wgboGAysFCDCBsjAzBggrBgEFBQcCARYnaHR0cDovL3d3dy5mcmVldHNhLm9yZy9mcmVldHNhX2Nwcy5odG1sMDIGCCsGAQUFBwIBFiZodHRwOi8vd3d3LmZyZWV0c2Eub3JnL2ZyZWV0c2FfY3BzLnBkZjBHBggrBgEFBQcCAjA7GjlGcmVlVFNBIHRydXN0ZWQgdGltZXN0YW1waW5nIFNvZnR3YXJlIGFzIGEgU2VydmljZSAoU2FhUykwDQYJKoZIhvcNAQENBQADggIBAGsxVL9h+d8yvTOJmd6wFQ6sM1Gs02C3ciAw0PA2HCXqgpYdUiGVicz/luiWN9ullMBuq/EcjfO1PT+zDFA6pNq3moElEBj9UfWf9Pgz24ONK67ep+HRkfk8v0Q2qhVbjiLk1P/OdB6/YwZc4AfDP2RnDDPP0wVfqFsaEGpZr6eUCpvtjvYoXOPfebU5UfFXZaXhgP1/3VtlMWlQQZbgq1uSbGl/+IYg9p/hYemgFb87oTOh8wpiXPjJfIQGHTBFFXJeW0uuP4wUeqF74+wwGWWr90Jo7hb8X4C4cSW7tpRhYwBJ6WmFYAmJSw0yvkcCh4JJKCKWp/UJKhYL6Tp7jffgXKb4jLhywx7H48bitJ2pclVD4BYR1FqNI8qHvIN+k2R2c7rKpAn+1J3XVdDlwvQz2Na4IPXMeWAD675HZyvLfKjbeMPupMYuFmpS9cLJaKAffT9D9FeOMPCtzgMmJD6BFjQWF1NiqW+AwE+vgtwkqc2SyK92P6RvPttVJusEDNGJrMr2XzjX/lcy0/0G8PSEoKlAW8/09KAILwRCcqqBJ7boVIkFoBBwDlOcrw0XiORsSUHF//PKHs/ciMeyjfmO2BRYPX+K2D0ElZthTAni18gukHYXTBuTUZxkMINmjJbdd/e2sCnP9l33eAXeOhz0eH1EW94pHNZDt11S3d6BMIIH/zCCBeegAwIBAgIJAMHphhYNqOmAMA0GCSqGSIb3DQEBDQUAMIGVMREwDwYDVQQKEwhGcmVlIFRTQTEQMA4GA1UECxMHUm9vdCBDQTEYMBYGA1UEAxMPd3d3LmZyZWV0c2Eub3JnMSIwIAYJKoZIhvcNAQkBFhNidXNpbGV6YXNAZ21haWwuY29tMRIwEAYDVQQHEwlXdWVyemJ1cmcxDzANBgNVBAgTBkJheWVybjELMAkGA1UEBhMCREUwHhcNMTYwMzEzMDE1MjEzWhcNNDEwMzA3MDE1MjEzWjCBlTERMA8GA1UEChMIRnJlZSBUU0ExEDAOBgNVBAsTB1Jvb3QgQ0ExGDAWBgNVBAMTD3d3dy5mcmVldHNhLm9yZzEiMCAGCSqGSIb3DQEJARYTYnVzaWxlemFzQGdtYWlsLmNvbTESMBAGA1UEBxMJV3VlcnpidXJnMQ8wDQYDVQQIEwZCYXllcm4xCzAJBgNVBAYTAkRFMIICIjANBgkqhkiG9w0BAQEFAAOCAg8AMIICCgKCAgEAtgKODjAy8REQ2WTNqUudAnjhlCrpE6qlmQfNppeTmVvZrH4zutn+NwTaHAGpjSGv4/WRpZ1wZ3BRZ5mPUBZyLgq0YrIfQ5Fx0s/MRZPzc1r3lKWrMR9sAQx4mN4z11xFEO529L0dFJjPF9MD8Gpd2feWzGyptlelb+PqT+++fOa2oY0+NaMM7l/xcNHPOaMz0/2olk0i22hbKeVhvokPCqhFhzsuhKsmq4Of/o+t6dI7sx5h0nPMm4gGSRhfq+z6BTRgCrqQG2FOLoVFgt6iIm/BnNffUr7VDYd3zZmIwFOj/H3DKHoGik/xK3E82YA2ZulVOFRW/zj4ApjPa5OFbpIkd0pmzxzdEcL479hSA9dFiyVmSxPtY5ze1P+BE9bMU1PScpRzw8MHFXxyKqW13Qv7LWw4sbk3SciB7GACbQiVGzgkvXG6y85HOuvWNvC5GLSiyP9GlPB0V68tbxz4JVTRdw/Xn/XTFNzRBM3cq8lBOAVt/PAX5+uFcv1S9wFE8YjaBfWCP1jdBil+c4e+0tdywT2oJmYBBF/kEt1wmGwMmHunNEuQNzh1FtJY54hbUfiWi38mASE7xMtMhfj/C4SvapiDN837gYaPfs8x3KZxbX7C3YAsFnJinlwAUss1fdKar8Q/YVs7H/nU4c4Ixxxz4f67fcVqM2ITKentbCMCAwEAAaOCAk4wggJKMAwGA1UdEwQFMAMBAf8wDgYDVR0PAQH/BAQDAgHGMB0GA1UdDgQWBBT6VQ2MNGZRQ0z357OnbJWveuaklzCBygYDVR0jBIHCMIG/gBT6VQ2MNGZRQ0z357OnbJWveuakl6GBm6SBmDCBlTERMA8GA1UEChMIRnJlZSBUU0ExEDAOBgNVBAsTB1Jvb3QgQ0ExGDAWBgNVBAMTD3d3dy5mcmVldHNhLm9yZzEiMCAGCSqGSIb3DQEJARYTYnVzaWxlemFzQGdtYWlsLmNvbTESMBAGA1UEBxMJV3VlcnpidXJnMQ8wDQYDVQQIEwZCYXllcm4xCzAJBgNVBAYTAkRFggkAwemGFg2o6YAwMwYDVR0fBCwwKjAooCagJIYiaHR0cDovL3d3dy5mcmVldHNhLm9yZy9yb290X2NhLmNybDCBzwYDVR0gBIHHMIHEMIHBBgorBgEEAYHyJAEBMIGyMDMGCCsGAQUFBwIBFidodHRwOi8vd3d3LmZyZWV0c2Eub3JnL2ZyZWV0c2FfY3BzLmh0bWwwMgYIKwYBBQUHAgEWJmh0dHA6Ly93d3cuZnJlZXRzYS5vcmcvZnJlZXRzYV9jcHMucGRmMEcGCCsGAQUFBwICMDsaOUZyZWVUU0EgdHJ1c3RlZCB0aW1lc3RhbXBpbmcgU29mdHdhcmUgYXMgYSBTZXJ2aWNlIChTYWFTKTA3BggrBgEFBQcBAQQrMCkwJwYIKwYBBQUHMAGGG2h0dHA6Ly93d3cuZnJlZXRzYS5vcmc6MjU2MDANBgkqhkiG9w0BAQ0FAAOCAgEAaK9+v5OFYu9M6ztYC+L69sw1omdyli89lZAfpWMMh9CRmJhM6KBqM/ipwoLtnxyxGsbCPhcQjuTvzm+ylN6VwTMmIlVyVSLKYZcdSjt/eCUN+41K7sD7GVmxZBAFILnBDmTGJmLkrU0KuuIpj8lI/E6Z6NnmuP2+RAQSHsfBQi6sssnXMo4HOW5gtPO7gDrUpVXID++1P4XndkoKn7Svw5n0zS9fv1hxBcYIHPPQUze2u30bAQt0n0iIyRLzaWuhtpAtd7ffwEbASgzB7E+NGF4tpV37e8KiA2xiGSRqT5ndu28fgpOY87gD3ArZDctZvvTCfHdAS5kEO3gnGGeZEVLDmfEsv8TGJa3AljVa5E40IQDsUXpQLi8G+UC41DWZu8EVT4rnYaCw1VX7ShOR1PNCCvjb8S8tfdudd9zhU3gEB0rxdeTy1tVbNLXW99y90xcwr1ZIDUwM/xQ/noO8FRhm0LoPC73Ef+J4ZBdrvWwauF3zJe33d4ibxEcb8/pz5WzFkeixYM2nsHhqHsBKw7JPouKNXRnl5IAE1eFmqDyC7G/VT7OF669xM6hbUt5G21JE4cNK6NNucS+fzg1JPX0+3VhsYZjj7D5uljRvQXrJ8iHgr/M6j2oLHvTAI2MLdq2qjZFDOCXsxBxJpbmLGBx9ow6ZerlUxzws2AWv2pkxggHtMIIB6QIBATCBozCBlTERMA8GA1UEChMIRnJlZSBUU0ExEDAOBgNVBAsTB1Jvb3QgQ0ExGDAWBgNVBAMTD3d3dy5mcmVldHNhLm9yZzEiMCAGCSqGSIb3DQEJARYTYnVzaWxlemFzQGdtYWlsLmNvbTESMBAGA1UEBxMJV3VlcnpidXJnMQ8wDQYDVQQIEwZCYXllcm4xCzAJBgNVBAYTAkRFAgkAwumGFg2o6c0wDQYJYIZIAWUDBAIDBQCggbgwGgYJKoZIhvcNAQkDMQ0GCyqGSIb3DQEJEAEEMBwGCSqGSIb3DQEJBTEPFw0yNjEwMTkwODU4MjJaMCsGCyqGSIb3DQEJEAIMMRwwGjAYMBYEFEgf1TxTTThBgMAoZRmgNvmIVEdmME8GCSqGSIb3DQEJBDFCBEDePE+fG/a2LyqRz6G5Ft9dzsnifJx3m7rIchZT74tEomeULWRYdzXlCPDLnWEVOoT2DrQG/yzfHRxjM5gBbH+QMAoGCCqGSM49BAMEBGgwZgIxAJJo7FxWCg8YWoRq+yM06ra4nzKKmjfAYOJequNxW8PDNd0F7JKuY4dXelyHMeDmdAIxAPcO5FJQrrw2QWQHkvM6ecr3QNn13Ie+eVq+ch6+ltJSDiyZk2f7ZAWkQ4oY/fcaWQ==",
    "sig": "8Vfuf3myMp4yg-XZUB-20ey96AlHpfIDqSPsk7QgVZtytXUIY904_OUd6d_TyCc0hMl_KZ_SWp_Pt0QRxjRGDA"
  }
}
